interview_id,turn_idx,turn_text,label,source,label_id
166777,11,"One of the few bright spots today was you were able to get Cam out there today. What do you see from him and do you feel like you can get him some more minutes in the rotation as the Playoffs go? NATE McMILLAN: We'll see. it was an opportunity to get him some minutes tonight, but Cam hasn't played ball 5-on-5 in four months. It's really tough to throw a guy out there in a situation like he's been put in. But we'll see. He's available. If there's an opportunity to put him out there and we feel that he can help us, we'll do so.",NEUTRAL,gpt,1
119569,7,"LeBron, with the limited minutes you've been able to play the last two games and the type of basketball you potentially have ahead of you here, what does it do for your body to be able to only play under 32 minutes in a Game 5? LeBRON JAMES: It's great for sure. Any time you're able to clock in under, for me, 35 minutes, it's great. But my body has been trained all season to do whatever it takes. Tonight was one of those instances where I didn't need it as much, but I've trained my body over quite a few months now to -- whatever Coach needs me, whenever this team needs me, I'll be ready for it.",POSITIVE,gpt,2
129755,1,"Well, he had really played very consistently, both minutes and performance, and then it was one of those deals where against the Bulls we kind of found a rhythm without him. That's a tough situation to be in, but to his credit, he really stayed prepared. He put in extra work. He was ready to help us in the Bulls series, but knew that his time would come if we were fortunate to get out of there. I thought from Game 1 on he was pretty darned good in the Washington series. , those are tough situations for anybody to perform well, but to have that kind of maturity at that age, to be ready, stay ready and keep a good mindset is pretty impressive.",POSITIVE,gpt,2
98821,1,"Â No, he didn't practice.Â He did the no contact stuff, and there's a minimal contact requirement he's got to do and be tested afterward.Â He's going through the concussion protocol.",NEUTRAL,gpt,1
176123,7,"It's easy buckets. Any time you can get some easy cheap ones, that always helps. But it's a lot easier to do it off misses, I will say that.",NEUTRAL,gpt,1
159779,2,"Our whole team was aggressive. Our whole team played with the right mentality. And most importantly responded to their good runs and tough shots really well and then pushed leads out. The run at the end of the first half was a great one and, , in response to when they cut it to four or five right there. And then, yeah, even when they got it closer in the second, with the exception of the last minute, I thought we responded. The last couple minutes, I thought we responded pretty well.",POSITIVE,gpt,2
176269,1,"No. This was brewing from last game. We got embarrassed at home. We had a bad taste in our mouth. So we wanted to come out from the jump and show that we were here and that we're going to keep fighting. So through all the ups and downs in the game, we just stayed together and kept battling through adversity. We've been doing it all year. It's been Next Man Up mentality. Vic played great today and we just had guys keep stepping up and made big plays and we got the win.",POSITIVE,gpt,2
130035,9,"He didn't. He was just happy. He was happy. He was excited. He sent everybody a text, and then Kelly [Olynyk] just called him, or he might have been calling Kelly right after the game, so it was nice to see a smile on his face. I just wish he was here.",POSITIVE,gpt,2
119391,2,"Well, when you shoot 35 percent, there are a lot of rebounds available. With Biyombo being the biggest guy on the floor, he's going to get those rebounds on the defensive end. But the main thing is with him having eight offensive rebounds is big for them. It gives them energy, gives them extra possessions after you play good defense, and they continued to come up with the offensive rebounds. It's big for them, but he did a great job of protecting the paint. He had some blocked shots, and he rebounded the ball well.",NEUTRAL,gpt,1
139844,5,"I think Boston does a great job moving the ball. I think the ball -- when everyone is touching it, it gives energy and it makes guys feel good. It makes guys feel good, and as a player you feel way more comfortable making a play if you touch it every possession, not just if you're scoring. But if you just feel the ball instead of going five possessions and just getting the ball and you have to shoot it with five seconds on the clock. You've got to get the ball hopping, and if we get bodies moving, we've got the athletes and the players, and if we can cause triggers, that's going to be in our favor.",POSITIVE,gpt,2
150096,7,"I think first of all, to accomplish what we've done, winning the Eastern Conference, you've got to really truly believe you can do it. That was kind of my message from Day One of training camp: We've got a good team here, we've got good players, we've got depth, we've got a lot of things. We've got to understand that there are a lot of good teams in the East, but we're right up there. I think that belief started things, and I think we always kind of thought that. So that's the starting point. And Kawhi is like -- I don't know how many more good things I can say about him. He's just so good. And again, I'm seeing a level of competitive greatness out of him. It's just his willing us to win and him grabbing those rebounds and willing those shots in almost it seems like and going down and locking up somebody and taking the ball from them. It's what it is; it's great competitive desire.",POSITIVE,gpt,2
99304,2,"Â I don't know.Â You'll have to ask him.Â I know he's looking forward to playing. Hopefully, we can play him extended minutes.Â Maybe I won't have to take him out tonight. Thank you. FastScripts Transcript by ASAP Sports",NEUTRAL,gpt,1
129917,4,"That's a good question. I think we just need to go out there and play. There's no magic formula. We need to just go out there and play, help each other on defense. And I'm sure that shots will fall on Sunday. They didn't tonight. We had some good looks, then we started to kind of get discouraged. The biggest thing for us is defensively, do what we do. We need to be way better. We haven't played to our potential I feel like the first two games. Just look forward to Sunday. FastScripts Transcript by ASAP Sports",NEGATIVE,gpt,0
176771,8,"Yeah, I think we've improved in that area. One thing I tell them is let me complain to the refs, you guys play through it, and I did plenty of complaining tonight. Enough for the rest of the group. I think, did we defend at a higher level in the second half? They got to the free-throw line a ton in the first half, and we caught up with that number. I think it was 8 to 22. So they only shot two in the second half, if I'm not mistaken. We guarded better, paid attention to detail, just got to fight through things. Refs are human, we have to play through stuff. It is what it is. Both teams are aggressive on defense, being very physical, and you just have to play through it, and I think our guys have improved throughout the year as far as that.",NEUTRAL,gpt,1
89567,6,"Â Right now he's giving us what he's got.Â Physically we know what he's going through right now.Â And for him to be out there competing and giving us what he's got, I have incredible respect for him as a professional athlete, and especially now the spotlight is on him and everything. But it's on me as well.Â I've got to get both those guys in places where they can be aggressive and comfortable.",POSITIVE,gpt,2
89581,14,Â It's the playoffs.Â All of uswe don't even know what day it is right now.Â It's either game day or off day.Â I really have no idea whether it's a weekend or a weekday.Â I couldn't even tell you.,NEUTRAL,gpt,1
109274,3,"Â Atlanta was collapsing early on your drives to the basket and then we saw later in the game an uptick of you driving and then dishing out.Â Was that an adjustment made based off how they were collapsing on defense? LeBRON JAMES:Â I'm able to make adjustments throughout the game, just knowing how the defense read and react.Â , when you've got guys like here, who shot the ball extremely well tonight, the defense starts to go further and further away from the paint, and I'm able to see creases.Â When they react to me, I'm going to find my guys.Â I'm going to know exactly where they're going to be every single time I drive.Â That's just a repetition we have through our practices and watching the film and knowing where your guys are going to be, and they have outlets, and they make themselves presentable, and I just try to put the ball right where it needs to be. I'm able to gauge the game and watch the game and able to replay it back in my mind and understand what I can do to help us win.",POSITIVE,gpt,2
119495,8,"Well, first of all, we have to have the mindset with play with pace, and I want to push the basketball. Second of all, we have to get stops. When a team shoots 54 percent from the field like they did last night, it's hard to get on a run. But it's got to be our mindset to get out, get early baskets in transition, open up the floor, and it's better for us.",NEUTRAL,gpt,1
166868,4,"I remember one time Giannis said, just do it stop by stop. I think Giannis's leadership in the time-outs, Giannis saying when you go to your defense, that's what you're talking about in your time-outs when you're not playing well, , we think that's where it starts. So I think Giannis and Khris and those guys just getting stops, trying to wear them down. So I think it's just good. That’s our identity. We want to be good defensively and play off of that.",POSITIVE,gpt,2
98705,4,"Â We lean on the history of playing together, but we also know that, just because of that doesn't mean that you're going to correct it.Â You've got to come out and do something about it. So we have to play a lot better.Â Defensive game, we have to‑‑ , we've got to do a better job of‑‑ , guys that make shots.Â We've got to do a better job of making shots when we get the opportunity versus a tough defensive team.Â So when you get your shots, you've got to take them, and we need to make them. We're going to win this series, winning it by defending, trying to keep them off the line, and not rebound the ball.",NEGATIVE,gpt,0
176121,6,"Some aggressive, overaggressive on defense. Got some favorable matchups that he drew some fouls on, as well, and then just even when our bigs were coming across reaching for no reason, we know he's a guy that wants to get to the free throw line, wants to pump fake and try to draw fouls, and did a poor job showing our hands and contesting there. Even Rob and Theis and some of those guys came over and swiped down and put him at the free throw line for no reason, so a lot of areas we can clean up easily. FastScripts Transcript by ASAP Sports",NEGATIVE,gpt,0
140009,2,"It's definitely new, yeah. being in LA, we had a lot of media around us with the different circuses we had there. But yeah, here, this is brand new. This is something completely different. You can't turn on SportsCenter, ESPN, nothing, without hearing Cavs this, Cavs that. It's definitely taken some adjusting. But yeah, I think I'm there now, and I'm ready.",NEUTRAL,gpt,1
166853,2,"Some of the things that Trae has been really good about, keeping defenses off balance with his floating game and also the lob. As someone who has played that position, what's the key to being effective in that moment, making the split decision to either just look for the floater or just lob it to John or Clint. What's the key as a playmaker making that split decision and making it right? NATE McMILLAN: He just has to be aware of where his guys are at, what the defense is doing, and a lot of times, making adjustments during the course of the game. Milwaukee came out very aggressive last game where they were picking up a player. They weren't sitting in that deep drop with Lopez. They just brought everybody up. We didn't really do a good job of recognizing what their defense was doing. They adjusted how they played, but we didn't adjust to the reads that they were giving us on all of our guards. , it wasn't just Trae, but, again, 20 turnovers, you're not executing. So you have to make those adjustments. We've had the opportunity to look at that on film, but Milwaukee will be adjusting according to the game, how the game is played, whether they are sitting back or being more aggressive, and those guys have to make reads out on the floor.",NEUTRAL,gpt,1
129837,0,"He just told me. It's a blessing, a blessing from God, for the Celtics for giving me an opportunity to be myself and my teammates, it's not just, I guess, something for me, it's for this team. They allow me to be who I am and they like me for who I am, so that says a lot about this team and this organization.",POSITIVE,gpt,2
99086,0,"Â Yeah, I think so.Â A lot of stuff that's putting us in the hole is stuff that we can prevent.Â So I think, if we just tighten up the areas we need to tighten up, we'll be all right.",POSITIVE,gpt,2
89576,12,"Â No question.Â Roy Hibbert is as important as anybody on this team.Â But also the length that we have at all the other positions as well.Â Paul George and George Hill in particular, with David West and Lance Stephenson with great length and great hands.Â And our bench as well.Â But it all really starts with Roy's ability to protect the rim.",POSITIVE,gpt,2
176646,3,"Nah. Not for me personally. I think they've been saying that since the Playoffs started for us. , it's a big stage, and they came out and played really well tonight.",NEUTRAL,gpt,1
140016,5,"I'm ready, yeah. Like we play -- it should be fun. We should come out and we should be more connected, we should be more excited, and we think we can hang with the best of anybody. It's all about mindset.",POSITIVE,gpt,2
119484,9,"You talked about that deficit. With as good a team as you are and as good of a player as you are, do you feel like when you took the lead by three, you had them at that point? LeBRON JAMES: I definitely thought we had finally got over the curve of how we wanted to play here in this building. But you've still got to get stops, and they did a great job of just making shot after shot after shot, even when our run was happening. You give them a lot of credit with that. They withstand our run and us giving up 54 percent shooting, a lot of it in the first half. , when you dig a hole like that, I think we were down by 18 at one point. Again, when you dig a hole like that, , every possession after that is so intensified. We got to a point where we were up, but we made a couple more mistakes and they was able to pull away.",NEGATIVE,gpt,0
119497,0,"I wouldn't say desperation. I would just say more urgency. I think that's what we did in the second half [in Game 4]. We picked up the intensity and physicality on defense, and that led to us getting some easy baskets. Then we really executed well to start the fourth quarter. But we just didn't get enough stops to separate. We were scoring well and getting some easy baskets, but we just couldn't string together enough consecutive stops to get any separation.",NEGATIVE,gpt,0
98702,12,"Â I don't have to prove anything.Â This team knows who I am.Â My organization knows who I am.Â , I'm just going to do my job.",POSITIVE,gpt,2
159563,2,"You could look back on it, the games that we played. Both teams are different now than last time we saw each other before we got down here. Guys are just playing at a different level. You can't worry about what happened in the regular season. You've got to look back on how they've been playing recently.",NEUTRAL,gpt,1
176183,3,"Yeah, but not in these circumstances. Not in the last two and a half years in my mind. Because we've been in this situation, too, all year long where I have no idea on my side who is playing due to protocols and testing and all of these things. This has been so uncommon. I think you just throw all that all out. It's not gamesmanship. I get it. I don't take anything from it, certainly not because I've been on the other side. One of my games this year when we had everybody, started to have everybody go out due to protocols, I didn't even turn my card in on time because I didn't know who was going to be available.",NEUTRAL,gpt,1
89144,13,"Â Well, earlier, when it comes to certain games, certain match‑ups, myself and LeBron, we kind of talk amongst each other.Â We kind of know what we want to do.Â We played them different times and have started off on Stephenson and he started off on George.Â I think we liked kind of at the end of the season when we played them and I started the game on George and he started on Stephenson.Â So it was just a read more so than anything. That last play I wasn't involved in it. LeBRON JAMES:Â We covered it the best way we could.Â George, going through my mind now, Paul George entered the ball to David West and he got the hand‑off.Â So UD and D‑Wade switched.Â D‑Wade ended up on David West and I was on George Hill.Â Me and D‑Wade switched.Â He got a DHL pass from David West, and he launched one.Â He launched one from a couple of feet behind the three‑point line.Â I was able to get a little strip on it, but he hit a big shot.Â Tough shot. So we still had an opportunity to win the game with 0.7.Â We just weren't able to get a good look at the end of regulation.",NEUTRAL,gpt,1
89454,0,"Â We have to be at our best.Â We've got to‑‑ our intensity, our determination, our focus has got to just keep getting better and better each game in this series. And we're going to need to be at our best if we have any chance to beat this team.",POSITIVE,gpt,2
159668,2,"Yeah, offensive rebounds, some key turnovers, miscommunication. They had some big shots. A lot of things went wrong. But got to get ready for the next one.",NEGATIVE,gpt,0
89506,3,"Â You never know with our team.Â Some moments it may look like it, and some moments it may not.Â Depending on the nature of the game, depending on other guy's opportunities.Â So you just never know.",NEUTRAL,gpt,1
129802,7,"It's what you saw on film coming in. you're going to get trapped. the blitz is going to come. I thought we were way better in the third and fourth quarter at playing with spacing around him and getting out of the play immediately, and then the ball started really spraying around. The problem in the third quarter was we just didn't get any stops for six minutes. We had hit the three going into halftime, and so whatever momentum you can have when you're down 22, at least you feel like, OK, it's not -- now if you score early, maybe you can make it interesting, but we just didn't get any stops. But we were scoring. So the spacing was better. The way we were playing together was better. I thought the attack was better. So we've got to get rid of the ball quickly and play versus the blitz after the ball is passed.",NEUTRAL,gpt,1
130006,10,"Coach Lue pretty kind of pinned it on the fourth-quarter turnovers. Was that more your lack of concentration or their hustle? LeBRON JAMES: A little bit of both. A little bit of carelessness. I had one when Kev ducked in, I should have faked high, bounced low. But I just threw it, and that lets me know I didn't have it tonight. Jae Crowder got his hands on it. We had a couple more turnovers where we just were either overpassing or overthinking or whatever the case may be. That definitely resulted in us not being as fluent as we've been offensively.",NEGATIVE,gpt,0
166907,0,"Yeah, it's a little disappointing. They came in with desperation, the desperation that they didn't want to go down 3-1. And we didn't have that same fight at the beginning of the game. We tried to get it back but when you start off that hot two games in a row, it's hard to really just find that energy and momentum and come back in the game. Every game, we've got to come out like it's our last game.",NEGATIVE,gpt,0
166782,3,"Yeah, I feel like firstly we've just got to be more patient and try not to just give the team extra possessions. But I feel like if anything I just feel like we need to have more movement off the ball, giving guys outlets in areas to catch the ball and try to create. So I feel like that's step one.",NEUTRAL,gpt,1
176652,2,", it's no secret. It's Game 7, trip to the NBA Finals, a lot on the line. A couple of us have been in this situation before, so we know what's at stake. We know how much this means to everybody. We know that going into the game.",NEUTRAL,gpt,1
129797,0,"It was great. it was good to get a little reprieve from all the other stuff we're focused on right now, watch 20 minutes of TV, things go your way, turn the TV off, celebrate with your kids, and then go back to work. It's a great opportunity for us. I think it's been very well-documented, and rightfully so, all the great things that Danny [Ainge] has done to help put us in a position to be as competitive as we've been, and also hopefully the way that we've all looked at it, we've had a lot of talks about it, hopefully sustainably competitive, which is a hard thing to do. So we'll see how it all shakes out.",POSITIVE,gpt,2
119418,3,"What it's like? Well, I will say it is what it is. But more than anything, it's just that you've got to give a lot to credit to my teammates. My teammates have helped me and allowed me to be myself, allowed me to be who I am, and I think as a result of that, there's a lot of trust that comes with it. They trust me. I trust them. One thing they always know is I've got their back no matter what. I just get out there and try to help my teammates as much as I can.",POSITIVE,gpt,2
119592,15,"Well, his position is right now, if we can get him the ball, we get him the ball, he can score, get him to post-up. But we've got to understand what he can do for us, and he's just definitely that guy coming back from injury. Some minutes are going to be taken from someone else, and shots are going to be taken from other people, but if it helps us win games, that's all that matters.",NEUTRAL,gpt,1
119232,0,"We won a championship. That was the biggest thing, just we had a great group of guys. We had Kobe, Shaq who led the way. We had great role players, too. Every night was a star in their role, whatever that role was, they just did it to the best of your ability. At the start of the season, we started off 11-0, and playing the first game in The Finals, I think we had 12 days off, and they just came in that first game, and they were just running and moving so fast that we couldn't keep up. In the second half we kind of caught up with the game and kind of figured them out, and we went to overtime and lost our first game. And then after that we were good.",NEUTRAL,gpt,1
166904,10,", I think we'll look at it and we'll feel like we could have been better to start with. But at the end of the first quarter, I think it was 25-22. So again, we didn't start well in Game 3 and here had a similar start tonight. But to manage it and get to 25-22 at the end of the quarter, but second quarter kind of got away from us again. So we have to do it for the 48, all the little winning things that go into it on both ends of the court. So we've got to work on that.",NEGATIVE,gpt,0
166699,5,"I like to blitz. I'm a blitz type of guy. I like to be up in the pick-and-roll. I've been playing that whole my life since I was a kid, being in the blitz and that type of thing. we'll make adjustments going into Game 2. We all talk about it and things like that. I think center field is more for guys like Brook. He's a bridge. I'm not a bridge. I can go out there and just try to move my feet as best as possible at the touch of the screen and get the ball out of his hands and make my man make the play. Make the 4 and the 5 man make the play. See if they can do that.",NEUTRAL,gpt,1
149954,12,"I think there's been very little. I'm trying to think of things I've heard and I can really only remember Kyle through the Philly series was immediately over, we were in the locker room and he kind of quieted everybody down and said, hey, listen, , enjoy this game, but we've still got a ways to go where we're trying to get to, so let's get back here tomorrow and let's get back to work. , that kind of mentality. Other than that, I haven't heard anybody say anything like that, and I think -- I think, like we really need to keep that out of our immediate thought. , we've got to zero in and focus on a tremendous challenge tomorrow night of coming in and winning this game on the road. And it's such a short-term goal, that that's really all we should be thinking about to the best of our abilities. I know it's not easy to sit here and think, oh my God, we could do it, but I'm certainly not thinking that way. I don't see any benefit in doing that. , we've got to really laser in and focus in on how hard we have to play to beat this team, and how much of a connected effort it will take, a togetherness effort on the road and band together and get a W. FastScripts Transcript by ASAP Sports",NEGATIVE,gpt,0
159844,8,"He was the guy we wanted to take. We were just hoping that he was going to be there. He always talks about guys that he's played with previously in AAU basketball. Bam Adebayo is the anti-AAU player. I've got to look up those records. I don't think he played AAU because he's wired differently, which we like.",NEUTRAL,gpt,1
