interview_id,turn_idx,turn_text,label,source,label_id
167566,5,"When you want to win and impact winning, you kind of have to sacrifice and do things out of the ordinary that you're not used to. With me, I played with a lot teams that would never be in this position, a lot of losing basketball teams, a lot of tanking times that want a higher draft pick. The coaches let things slip and slide away when you're on losing teams and don't really mention that. Out here, every possession matters and Coach Bud stays on us about it: taking care of the basketball, rotating on defense, low man being there, top man X-ing out and all be connected on the floor talking and communicating. All those things just help me be a better basketball player, and I credit him and his staff for that. They really locked in with me the first couple months of the season, just on me, on me, every day about defense. Some days, I was like, damn, I can't do nothin' right. But just with it and being myself and trusting these guys has helped me get to this point.",POSITIVE,gpt,2
140381,6,"Yeah, yes, yes, I think he understands. I think you have to have an understanding, right? I think that's where it comes into play as a former player. He's played in this league. He's been to The Finals. He's won championships. So he understands what it takes, and he understands the pitfalls that come with it.",POSITIVE,gpt,2
90175,1,"Â LeBron, can you talk about just your upcoming moment tomorrow.Â Are you antsy, excited, nervous about the situation where the whole spotlight primarily will be on you? LeBRON JAMES:Â I already know that.Â It is what it is.Â I understand the moment for me.Â I've been pretty relaxed, though.Â I've been pretty relaxed throughout the playoffs.Â I'm going to be antsy, I'm going to be excited.Â I'm going to have some butterflies.Â I'll be nervous.Â Everything.Â That's how I should be. The moment is going to be grand.Â , I'm happy to be a part of it.",POSITIVE,gpt,2
130692,6,"He's been great. He's been as vocal and present as he's been all year, just giving his input when he needs to. he's not talking as much in timeouts and huddles and stuff like that, but from game to game, in the practices, he's giving us that Mike Brown presence that he brings to the coaching staff and he's brought all year. So it's nice to have Coach Kerr back and the normal flow, but doesn't mean anybody else just falls to the back, to the shadows. They all have huge impacts on our game plan and our adjustments from game to game.",POSITIVE,gpt,2
110341,1,"Â Exhausting.Â Exhausting.Â More mentally than anything.Â 82 games is a long season.Â You go through 82 games and you play hard.Â It will prepare you for the physical load, and then playing him a lot, I kind of knew how to lessen the blow, , or expecting it. But mentally just thinking about it every single day, during practice, after practice, at night when I sleep.Â My nap, I had no nap today.Â I usually get a nap, and I couldn't sleep because I just kept thinking about the game and what do I need to do to win, how to guard LeBron. That's what makes him arguably the best player in the world right now, because you have to put so much effort in, not trying to stop him, but trying to contain him, because you really can't stop him.",NEGATIVE,gpt,0
120323,7,"And you talked before 3 for obvious reasons about do or die. Now that it's 2-1 and you won a game by 30 or whatever it was last night, how do you keep that same edge? LeBRON JAMES: It's the same. It's the same mindset. We can't afford to go down 3-1 and go into their building and give them confidence going back. So it's a do-or-die game for us still.",NEGATIVE,gpt,0
150459,9,"Yeah, , first of all, our half-court defense is -- first of all, it's about getting it set up. There was a lot of quick possessions by them, again, probably due to our offense, so that's the first thing. Second thing, our half-court offense is very physical and it wasn't very physical tonight in the right way. And then again we just made some weak-side mistakes.",NEGATIVE,gpt,0
160066,5,"Yeah, we got a lot of those rebounds, not even with our big lineup. There's a lot of holes in the zone. That's one of them, being able to crash the boards. And we definitely punished that aspect of their zone defense.",POSITIVE,gpt,2
120605,12,"The film that we watched and the way that Coach kind of broke it down was in a way that was very positive because you could kind of just see us on the offensive end, especially the mistakes that we made and the things that we just didn't do when it comes to creating rhythm. It wasn't anything -- it wasn't a lot that Cleveland did defensively that took us out of who we are as a basketball team and how we play. So you just have to find that. There's nothing really you can do except go out on the floor and execute and stay focused on the ways that we're going to be successful. And that's by everybody touching the ball, the ball whipping from side to side, setting great screens, making hard cuts and just resisting the urge to be stagnant and to be passive. Then on the other end, you can't give them easy buckets off of turnovers and you can't give them easy or open shots off of breakdowns because they have talented guys that are going to make plays anyway. So you can't just gift them stuff on that end of the floor. So that's it. We understand what we have to do, and there is nothing you can do between now and then except wrap your mind around that focus and go out and do it.",NEUTRAL,gpt,1
89778,5,"Â His role hasn't changed at all.Â He's Manu Ginobili.Â He's a great competitor, great player, and he just plays his game.Â His role hasn't changed a bit.Â He's always been very important in us winning basketball games.",POSITIVE,gpt,2
167292,0,"Yeah, I think there were some games in the previous series where we didn't bring it. Simple as that. And not on the make-or-miss didn't bring it; just from the energy standpoint, energy and effort. I think since that game we have picked it up in that regard. We understand we can't control if we make or miss shots, but the 50/50 balls and the intensity throughout the team can always have another level.",NEGATIVE,gpt,0
150497,1,"Right, well there's definitely highs and lows, but at the same time I think the most important thing for me is being able to impact the game without scoring or because if you score 30 points like you're the best ever. But if you score 10 it doesn't matter what you did, it is your worse game. So I think for me it's knowing that, especially with the team that we have, is that I can score sometimes and score 30 and sometimes I can score 10, but I have to be able to have an impact to the game and on defense and being able to bring that energy to the team. That's something that has to be consistent and maybe I could have had a better energy or anything like that, but I think that just making sure that the things that got me there or the things that I do well and I can do without -- like I can control those things. I have to be able to do those things consistently every single game.",NEUTRAL,gpt,1
167842,9,"I was a little bit dehydrated. I was a little bit dehydrated. I'm a softy, but it's okay.",NEUTRAL,gpt,1
99501,0,"Â , for some reason it always works out that we always lose the game before a two‑day rest and then kind of really just gets us going.Â I would rather play the game today, but I guess it's punishment, you have to wait a little bit longer. We have to really take it as just taking some time to get‑‑ to really get some game plan, more game plan in, make sure we work our game and let our bodies rest and recuperate and get ready for Game 2.",NEUTRAL,gpt,1
109719,7,"Â That's my job, to create extra possessions for my teammates and for my team.Â And Draymond does the same thing for his team.Â So the key is definitely controlling the glass and controlling defensive boards because those are two skills that can definitely deflate your defense. If the team has offensive rebounding in the first 24, it's definitely playing into your defense.Â So it's not just myself.Â It's Timo, LeBron, Shump.Â We've all got to rebound collectively and keep them off the glass. FastScripts Transcript by ASAP Sports",NEUTRAL,gpt,1
99472,5,"Â No, I don't wear sleeves or compression shorts.Â But I don't think anything would have made you more cooler in that gym.",NEUTRAL,gpt,1
167639,1,"That's elite. That's an elite block, to be able to read that he's going to throw the lob and go up there and get it, yeah, that's elite.",POSITIVE,gpt,2
160133,15,"We're always confident. We know that we can win any game if we rebound, if we don't turn the ball over, if we get back, things like that. But we got a group that, like we're, I don't like the word ""underdog"" so -- nobody's picking us, there you go, nobody's picking us. And we really don't care. We're going to go out there and compete that's what we have been doing all year long, all playoffs, the time that we have been here. Stay confident because we know we're a good team. FastScripts Transcript by ASAP Sports",POSITIVE,gpt,2
140369,11,"Oh, well, , you go down that list, what J.B. has in physical gifts and the ground that he can make up with his athleticism is incredible. And he's continuing to learn the game. Looney is one of those guys that really understands the game. He knows where to be. He's always in the right spot. Shaun understands the game. Shaun took that last series personal. Like there was a point in a couple of those games where he really wanted to lock into C.P. And he did. There were times where Klay and Kevin were on the floor, and he was like, I've got James Harden. He really stepped up for us big in that series defensively as well. So with all that, I think Shaun has the experience, but Looney with Andre out, Looney has been able to get a ton of experience. Jordan has been able to get a ton of experience, and that will bode well for us moving forward to, , whenever Andre comes back. FastScripts Transcript by ASAP Sports",POSITIVE,gpt,2
150966,5,"Get there when we get there. Right now, we're just focusing on how we continue to get better. Tomorrow will be a tough task, and we'll be ready to go. We'll be ready to play basketball. 48 minutes on that hardwood and we'll go out there and do our jobs and play extremely hard.",POSITIVE,gpt,2
150525,6,I hope he wouldn't. I'm probably not quite as durable as Kyrie and it might put me out for the summer.,NEGATIVE,gpt,0
177486,4,"Everybody on this team is selfless, from the top all the way down the food chain. The humility that guys have, we want to see everybody be successful. We want to win games. And being able just to have that with as talented of a team that we have is rare. We go out there and we fight and we play for each other night-in and night-out all season. It just shows how connected and how together we are. It makes it easy to go out there and play with guys that you really enjoy talking to, not only as basketball players but as people, and I'm glad that we were able to get it done with this really, really, really special group.",POSITIVE,gpt,2
89954,4,"Â Yeah, we definitely need Manu.Â I think everybody we need to help him to try to get his confidence going.Â But I have a lot of confidence in Manu.Â I'm sure he's going to break out of that slump.Â I've been playing with him for a long time.Â I just know he's going to have a big game soon.",POSITIVE,gpt,2
177485,2,", I think for us, myself, it's just everything that we have accomplished, everything we had to go through to even get to this situation. Nobody even had us being here, let alone in the playoffs. It definitely is tough. But it's definitely one of those things we've been through hell to get here, and you take that. what I'm saying? We got to use that. It's going to be tough. That's what I know for myself I'm viewing it and looking at all the s--- we had to get through to get here just to even get to this situation to have an opportunity. Proud of this team. we didn't accomplish our goal. A lot of people, I'm sure a lot of you guys in here, counted us out early on in the season. For us, we'll take it.",POSITIVE,gpt,2
90211,3,Â I'll turn in my card in about 45 minutes. FastScripts Transcript by ASAP Sports,NEUTRAL,gpt,1
159952,7,"Not really. Being about in my situation, I don't really have anything to lose. , very few times have I actually been like, I don't know how to put it, because I don't want to say selfish. I think that you have to be selfish sometimes. I told my son the other day, sometimes you have to start being selfish. The way my game is, pass first, always looking to deflect any attention. Trying to be humble, not saying I'm perfect at it. In that situation, I had to be selfish and I think I was in an opportunity that could have been, and selfish probably the wrong word, but being in an opportunity where I can dictate my future and trying to do it the best way possible and most professional way possible, and then everything, just having faith in what I believe in and things just really worked out. So you've got to give a lot of credit to the beliefs that I have and standing on those beliefs and believing that there's a higher power. Everything just kind of worked out. It's been interesting. The last couple weeks I've been thinking about that a lot, really been blessed with the events that have occurred in my life.",NEUTRAL,gpt,1
120541,5,"Our confidence comes from being the defending champions, from winning at an incredibly high rate the last two years. And let's be frank, we were put in a pretty difficult position in Game 5 without one of our best players, and we didn't respond well enough. We needed to play better in Game 5. But we'll have Draymond for Game 7. We'll have our home crowd. We'll have everybody but Boges. We missed Boges tonight, but we still feel very confident that we can win without him. , you get one home game to win the NBA title, that's not a bad deal.",POSITIVE,gpt,2
167880,1,"Both. It's very much how we play. It's an emphasis for us. We feel like it's one of the times in the game when we're kind of playing to our strengths. We want to do that, including tomorrow night and as much as we can first quarter, fourth quarter. We talk about it. We emphasize it. We feel like it's playing to our strength, and we got to continue to do that.",NEUTRAL,gpt,1
160297,1,"Yeah, I like those decisions. we had everybody in the paint, LeBron just had a bunch of those possessions in the fourth quarter where he was just getting to the basket, offensive rebounding, everything at the rim, to the free throw line. So we needed to bring not only a second defender there, a third defender. Then they cut and of course Danny Green is there. But there was a karma to it. I thought our competitive spirit throughout the course of the game was great. Sometimes it's make or miss and sometimes you need to be a little bit fortunate; we were. But we also made a lot of plays, particularly on the other end. Jimmy, again, his will to win is remarkable. To do that in 47-plus minutes and take the challenge on the other end, this is -- every young player coming into this league should study footage on Jimmy Butler, the definition of a two-way player competing on both end, five steals, and then making those big plays down the stretch for us offensively.",POSITIVE,gpt,2
131029,2,"This is what we talked about this whole year, realizing this goal and understanding how important we both would be to the equation, along with our teammates, and learned a lot about each other going through this journey. The way that he embraced the opportunity in The Finals, it was unbelievable. It's kind of crazy to think about the conversations we had this summer and going into the year about how we can both mesh and do what we do and be the players that we are and see it come to life in this series, it was unbelievable. So we're just getting started, this is something that we want to continue to do, but for us to have these conversations that we had almost a year ago and now being in this position, worth every shot we took in practice, fighting through injuries that he had this year, and it's an unbelievable feeling. I'm happy for him. You got to call Kevin Durant a champ now. He's put the time in and I'm just so happy for him to be able to realize his goal and be my teammate.",POSITIVE,gpt,2
160214,0,"We took some time off yesterday just to kind of get away from it a little bit, and we reconvened today, met, watched film, went over some stuff, practiced, got some work in, and we're all ready for tomorrow. Excited for the opportunity.",POSITIVE,gpt,2
120675,5,"I understood that I didn't have time to be anything less than myself. I didn't have time to worry about what was going on with what everyone was saying about what we needed to be as a team. What I needed to do, what the lineup should be, what kind of player I, myself, needed to be in order for our team to be successful. I talked to Bron, I talked to T. Lue, I looked for a lot of wisdom from our veterans, and it was just constant, constant, a feed of confidence from all those guys. The magnitude of taking Toronto to six, of kind of sweeping the first two rounds, of being in that moment, being down, and then being in The Finals, it was game to game. It was just growth, growth, growth, and taking it one possession at a time. So I'm really thankful to have the bonds that we have, that we created in that locker room that we started when I was still limping around in the facility and watching those guys get geared up for the beginning of the season. So I just think back to those times and just really stayed focused on what was at hand, and that was the gold trophy.",POSITIVE,gpt,2
176978,4,"I just tell Jordan to relax and not be too hard on yourself. He reminds me of my younger self. You want to be great every night, but the nature of the beast, it's not like that unfortunately. There's going to be lulls and there's going to be highs, and just stay even-keeled and realize it's the war of attrition at this point in the year. So as long as you stick to your process, great things are going to happen. He's already proved how vital he is to our team. I just remind Jordan, we all have bad games. Even the greatest to ever play have had bad games. Turn off your phone. Don't watch television, sports media because it's very reactionary. When you're at the center of the basketball universe, everyone has an opinion. That can wear you because there's so much time between games. You don't want to think about things that might weigh on your mind. So it's about staying locked in on what you can do to be better and not paying attention to the outside noise. FastScripts Transcript by ASAP Sports",POSITIVE,gpt,2
109720,4,Â Can I say something nice about the other team?,NEUTRAL,gpt,1
177281,5,"Yeah, for sure. We knew that Klay was going to come back. But it's just another chance for me to help a team that's trying to get back to where they were, and then trying to get myself back to play at a high level that I was. It just worked out.",POSITIVE,gpt,2
177221,2,"I think our defense is going to fuel our offense. That will help Jordan get going. That will help everybody get going. We're at our best when we can open up the floor, get into transition. We did that in Game 2 by playing great defense, playing with a lot of force, rebounding. We’ve got to rebound better. The other night we got crushed on the glass. They controlled the whole game. That made it difficult on Jordan and really the whole group. So to me it starts with our defense, and that will help our offense.",NEGATIVE,gpt,0
176973,0,"It was everything that I dreamed of playing in the Finals. The atmosphere, the hype, the intensity of the game. For my first Finals, it was amazing despite the outcome. But it was everything I thought it would be.",POSITIVE,gpt,2
150600,6,Play harder. Play better defense. Our defense stunk the other night. We got to play better tonight.,NEGATIVE,gpt,0
167072,7,"I don't remember -- one of the early games. Until you're around somebody you don't really know, but the versatility of him as a defender, his ability to guard lots of different types of players was really impressive, in one of the first or second games he was with us. I would say just ability to guard wings and more perimeter-oriented guys. I think there was a real vision of his physicality on the block, his physicality in the paint, his ability to do that, but then to guard different types of players really stood out very, very early.",NEUTRAL,gpt,1
130620,8,"I don't think that's a silly question at all. I think it's a great question. , I personally feel like this team can, there's another level. And we do have a weakness, and Steve Kerr, he knows what it is, and I feel like I know what it is, and if we can continue to grow in that area, then it's really scary.",POSITIVE,gpt,2
167770,1,"Yeah, I don't want to give up too much, . I just think you've got to make it as much -- he has to feel you. Physically he has to feel you a little bit. When he plays in space he's very dangerous, so I just think he has to feel you. A lot of different coverages at him, but I think first and foremost he has to feel the presence on the ball and then from there you mix it up.",NEUTRAL,gpt,1
120617,0,"It's one more game. We've been facing elimination the last two games, so this game is no different than the last two. If anything, this is the first time that they are going to be a different team because they're facing elimination. They faced it in the Western Conference Finals, but they're facing elimination now. We look at it from the perspective that we've got nothing to lose. They were the best regular-season team in history. They are the defending champions. It's Game 7, it's on their floor and they were up 3-1. No one picked us to win the series. We're not favored to win this game. And I'm not playing the underdog role; I'm just putting everything under the microscope and saying that we're in a position to play free and play hard. If we lose this game, no one's going to be talking about anything on our side. If we win this game, people are going to be talking a lot more about the Golden State Warriors and what they do.",POSITIVE,gpt,2
176837,3,"Yeah, everybody understands where they're supposed to be. , it's a little random offensively, but it's controlled randomness. , Looney, Wiggins, Poole, everybody that comes off the bench for them, like, they know where they're supposed to be. They know how to get those guys open. , they're always competing and doing what they need to do. They got a good culture here. They do a good job. FastScripts Transcript by ASAP Sports",NEUTRAL,gpt,1
90118,4,"Â I think I designed╩‑‑ I ran only one, like the end of the third quarter, because I didn't want them to blitz me and we couldn't control the time.Â I knew it was the last possession, so I wanted to have control of having taking the last shot. Tony had a few more because he was rolling, and we knew that was going to happen.Â My thing was just moving the ball and attacking seams.Â It's not they were just falling flat and going one against my defender.Â It just happened randomly.",NEUTRAL,gpt,1
89742,0,"Â Well, it's the playoffs, it's not the regular season.Â These are the best of the best teams.Â It's more challenging.Â No team in history‑‑ I don't know, but I don't think no one swept straight through.Â Anyone ever swept straight through the playoffs?Â No.Â It's impossible.Â So it's not going to happen. I think that we've had some games where we've played unbelievable basketball, and I think we've had games where we haven't.Â We would love to be a little more consistent with it.Â But you have to give credit to other teams of taking certain things away. But I think we've always done a good job of once they do that of coming back and making adjustments we need to, as the good teams do.",NEUTRAL,gpt,1
90155,4,"Â LeBron, you made the three that got it within two and then on the possession Ray‑‑ you missed the first three.Â When Chris got the rebound, you were screaming for the ball.Â You were jumping.Â Your arms were up in the air.Â Did you think Ray was going to take the shot or did you want to take that shot? LeBRON JAMES:Â If it's not me taking the shot, I have no problem with Ray take that shot, man.Â He's got ice water in his veins.Â Ray can‑‑ , Ray can be 0‑for‑99 in a game and if he get an open look late in the game, it's going down.Â That's just the confidence he have in himself.Â It's the preparation that he prepares for every game.Â It's the confidence that we have in him.Â We seen it before.Â We seen it before. We're happy to have him on our side.Â And this is the reason why we wanted him in games like this.",POSITIVE,gpt,2
177226,1,", I got some great looks all night, and come playoff time, especially in the Finals, it's hard to get good looks. Teams going to blanket us. So when you get that little, , space, you've got to let it fly. Been in this league too long to ever doubt myself, especially in the highest pressurized moments. You've just got to let that thing go and trust your word, trust your touch, and luckily I made them when they counted. Still thinking about that one I missed on the left wing, great pass from Andrew, but luckily I have Draymond who made an incredible rebound, and I'll make it on Monday.",POSITIVE,gpt,2
