interview_id,turn_idx,turn_text,label,source,label_id
150479,4,"Honestly, I don't need anybody's validation or praise or them to hype me up as other people in the league know who I am. I always stay confident in my abilities and appreciative of the stage that I get to play on alongside my teammates, especially these last five years. So whatever comes with that territory, that doesn't really bother me, whether I'm liked or disliked or whether people respect my game or value for what it is. Doesn't really matter. I have great teammates who understand, one, what it takes to win and just the fun that we have playing the way that we do and the experiences that we have been able to create. , that's all I'll remember when this is all said and done. Andre is the guy that kind of sets the tone when it comes to the overall perspective of what we're doing and protecting the conversation around that. But again, , I love playing for championships and being on this stage and want it to continue for as long as it can.",POSITIVE,gpt,2
150173,10,"I tell you, when I saw him in Basketball Without Borders, no. We all want to act like we know everything, but we don't. That guy has been incredible and I think his progress you've seen. Even during the year, Pascal I think should have been an All-Star. He wasn't a All-Star. At All-Star he elevated. After All-Star he elevated. There was a chip on his shoulder during the Playoffs. Everybody said he's young, new player in the NBA; he elevated even more. He's been an unbelievable revelation for us, but I know Pascal and we have had these moments of talk, and he specifically said to me a couple years ago that he doesn't want to be one of those African players that's labeled, whether it's a shot blocker or a defender or rebounder or he runs. He wants to be a star. He wants to be a versatile player in this league and he wants to be able to do it all. And he's put the work into it. We all used to hold our breath when he took a 3-point shot. We all used to hold our breath sometimes when he went on the fast break. And now we can't wait until he does that. Again, it's preparation, it's practice, it's work ethic, it's that mindset of winning and I think he has that mindset, too.",POSITIVE,gpt,2
150348,1,"It would have been way more fun being up 1-0. But it's definitely fun in terms of the challenge of being on this stage and understanding one game doesn't define a series. It's an opportunity for us tomorrow to come out and get one, be 1-1 going back home, which any road team would love that opportunity. The things that we need to do differently as a team in order to win is the stuff that is the special part about the challenge -- energy, effort, focus for 48 minutes. Being on this stage again, no matter what the experience is, we're playing in the NBA Finals and we're chasing a championship and everything that comes with it is what wakes us up in the morning, puts a smile on our face. We have had a lot of great experiences and had a lot of battles and a lot of challenges, and we have done well with them. So hopefully this is more of the same.",POSITIVE,gpt,2
150273,2,"I think he's doing okay, but we'll have an update tomorrow.",NEUTRAL,gpt,1
89776,6,"Â It's very urgent.Â you don't want to go down 0‑2 going to San Antonio for three straight games.Â Odds are not that good.Â They are not in our favor. We're not a team that really says too much, this is a must‑win game, but this is a must‑win game.Â For us we have to win this game at home.Â We have to come out and play a lot better and we have to also expect San Antonio to play a lot better, shoot a lot better, a little bit from what they did from Game 1. After the first game when you come and you feel each other out, now you start to get a little understanding of what guys want to do and are going to do.Â So it will be a more competitive game, but it will be a tougher game than even the first one.",NEGATIVE,gpt,0
109803,4,"Â Well, we learned‑‑ we've learned that we play a huge role on this team besides just coming in and scoring or looking to be individually effective.Â We've learned that our unit and our flow in the game can have a carryover to our first unit once they come back in the game and finish out the half or finish out the game. That's been really important for us.Â We've seen it happen a few times early in the year, and then it started to be a trend for us.Â , we see the game not starting off the way we want it to, and we kind of give each other that look like in three or four minutes, let's turn it up.Â Now we don't even have to speak or look at each other, we just know.Â So that's really key for us. Practice has really been great all year as far as first unit versus second unit, so that prepares both teams.",NEUTRAL,gpt,1
150356,4,"The three-point line. It's pretty obvious, but you just can't take one thing away. If you take the three-point line and you allow them to swing to the basket to get dunks, it's just as bad. So it's a multiple-effort thing. You have to be in multiple places, especially when you're a help guy. You have to be up. You have to be down. You're going to be up again. You're probably going to have to crack back and rebound. So it's a lot of fun.",NEUTRAL,gpt,1
99457,5,"Â Well, I'll tell you‑‑ I guess I shouldn't tell you.Â That's what he does, .Â That's his major skill.Â If he's not going to do that, then we might as well play somebody else.Â That's the honest to God's truth. I thought the percentages were with him.Â So we stuck him back out there and he came through.",NEUTRAL,gpt,1
110229,3,"Â Well, any little rest you can get throughout the postseason run, , it's like a lifeline.Â For us to be able to get this extra day to mentally and physically prepare for tomorrow night or tomorrow day is definitely helpful.",NEUTRAL,gpt,1
120489,6,"This is a question not related to the game, but since there's been a lot of publicity yesterday and today about Godfather II, what is the phrase that you like more from the movie? LeBRON JAMES: Oh, Godfather? There's too many different phrases and too many different lines in that movie to just categorize one.",NEUTRAL,gpt,1
167112,4,"I think we need to be more consistent in order to put ourselves in a position to win Game 2 and defensively it's making it hard on them and making them feel more uncomfortable. And then Giannis's leadership, second to none. One of the things I've said a few times over the last few days is, , his growth as a leader since the day that I got here was evident when he did go down, when he did get hurt. He was still present. He was still at our practices. He was still at our film sessions. He was addressing guys individually, pulling them off to the side. He was addressing the team collectively before games, during games, after games. I think that speaks volumes to what he is as a leader, especially in today's NBA where sometimes you see guys who are injured not be as present because they are focused on getting back. Giannis was able to focus on getting back and get his body in a healthy position to play Game 1 of the NBA Finals, but he was also present in all of our team activities in order to make sure that he was instilling confidence in us both individually and collectively.",POSITIVE,gpt,2
167828,3,"We always talk about taking what the game gives us and playing good basketball, making good reads. Certainly the ball in his hands is a good thing. I think credit is to Jrue and Giannis and everybody, really, I think continuing to find him and put him in a good spot. Every night it can be somebody different. That's the great part of a good team. I think the great part is that Khris knows and understands it and trusts it.",POSITIVE,gpt,2
150195,2,"Definitely a lot different. I'm from the Midwest, so being in a different city is a different feel. It's fun to have something new. It's a new challenge, a new team, a new city, a new country. It's going to be a lot of fun. I'm excited to see what the Toronto fans bring to the table. The Cleveland fans were rowdy and they were tough. I'm excited to see what Toronto brings. Watching on TV, watching Jurassic Park, it always seemed like they had a rowdy crowd, a lot of crazy fans. I'm excited to be able to be on the court and see the environment.",POSITIVE,gpt,2
119827,7,"Yeah, but that's part of the journey, having to switch up your game plan or switch up your defensive principles depending on who you're guarding. In order to be a champion, you have to be able to do that from game to game and from series to series. And that's the case here.",NEUTRAL,gpt,1
167293,8,"Mainly C and Book and Jae Crowder, as well. He's guarded Giannis and he knows a lot of stuff. Especially when we were in the Lakers series, as well, he helped me a lot with AD. Just saying, what does he like, does he drive left, does he drive right, what does he do when you stop him going left, stuff like that. I say, what does the team like to do if I roll, does everybody collapse or do they stay out; or do I have a one-on-one matchup down low. , things like that, brainstorming.",NEUTRAL,gpt,1
150977,9,"There's a bunch of games that I could put together. We had some really good defensive stretches or defensive games. Very few games where we had lulls and the team scored over 115 or 120. A lot of times to keep them in the low 100s or under a hundred is tough to do. But each one of them is very important. Each game is important, and we probably need to be even better next game if we want to try to win this series. FastScripts Transcript by ASAP Sports",NEUTRAL,gpt,1
167592,2,"Yeah, it's great to be back here. Every time I come to Milwaukee I have a sense of appreciation for the city. They took me in. I see familiar faces here that work in the arena back when I was a college kid. I see the same familiar faces now, nine, 10 years later. It's great to just see familiar faces and people that I'm so used to being around and being in a city where I grew up in a little bit. It's great to be back here playing at this level and having this opportunity in front of me here in this arena in this city.",POSITIVE,gpt,2
119877,4,"It was definitely a different game. But the one thing we always preach about is our depth. And we've trusted in that all year, and last night it showed up in a major way for us. So it was good to have other guys step up, especially in the light of the struggles that Klay and Steph had. And we know they won't struggle like that all the time. But to be able to win the game the way we did with those guys struggling like that says a lot about this team. But it was definitely a different game for sure.",POSITIVE,gpt,2
140382,0,"It's been a lot different for me. Last year really just coming in and watching and supporting. Instead I actually have a chance to have a role. Play some big minutes and try to make a difference in each game is a big deal for me. I think the playoffs -- been different this year for our team. Last year, we went 16 and 1 throughout the playoffs. This year we had a tougher series, tougher games. It's been a lot of fun. It's been great. Makes for a better story now. So hopefully we can carry it on with some fun.",POSITIVE,gpt,2
89718,4,"Â Yeah, that's something that we have to look at.Â I thought thatwe were a little fatigued, honestly, in the fourth quarter, looking around.Â We looked like a team that came off a seven‑game series.Â I thought we got some shots we wanted.Â But we were a little careless at times as well.Â We turned it over. Like you said, we did a great job all game.Â I think we only had three up to that point.Â But having five in the fourth quarter isn't going to win you a game, especially not in The Finals.Â We'll be better prepared next time and hopefully make better decision in the fourth quarter.",NEGATIVE,gpt,0
110293,5,"Â Well, it's just mentally more than anything.Â The mental challenge is you're not going to give up no matter what.Â You might feel some fatigue.Â I felt like there were some moments when he got the best of me on a low block, made some tough shots.Â But mentally you've got to say you're going to get a stop every opportunity you get, and you've got to keep just grinding it out.",NEGATIVE,gpt,0
90156,6,"Â Whether CB threw me the ball or not, I had to get myself in a position where I was ready.Â Once the ball came off the rim, I just knew get to the three‑point line. Â We need a three.Â Two points isn't going to cut it.Â So my mental checklist is really to have my legs ready and underneath me, so when the ball comes, if it comes, I was ready to go in the air. So that's pretty much‑‑ once I get my legs there, I let the ball go.Â I'm going to give myself the best chance to make it.",NEUTRAL,gpt,1
140658,7,"Absolutely. They play better at home. They shoot better at home. So I think our defense is definitely going to have to be sharper, box outs, really contain them on the glass. The role players, , they play better as a team at home, so we'll have to pay more attention to that.",NEUTRAL,gpt,1
150552,11,"I think they try to move or at least allow the player, if the player is making a play at it, give him the opportunity to make a play at it. Just like in baseball. , as a fan you get in trouble for reaching over for the home run or grabbing the ball when a guy has an opportunity to make a play at it. So we got to give the player a chance to get there, and I think the best bet is just move out of the way if you possibly can.",NEUTRAL,gpt,1
150439,2,"Probably. Well, depends how it goes. I usually think when a guy is off for a long time, I would say to him it's probably going to be a three- or four-minute burst because I think that that's probably with the speed, the way the game's moving at this stage of the season, what they could handle. But I think one time this year Fred VanVleet had come back after a long injury and we had to start him; I think Kyle was out. I told him I was going to play him short stints and right before the ball went up he said, ""My conditioning is great so if you want to let me run, I'll be okay."" And I think I played him 18 straight minutes or something like that. So , I guess it's all feel. You probably think three, four, five minutes is probably a high end for that kind of stint, but you never know.",NEUTRAL,gpt,1
140542,7,"I just think it reminds me a little bit of our first series of this postseason against Indiana. I was a little banged up, especially after Games 1 and 2, and shot pretty poorly. That's just the way it went. I think, what was it, in 2016 I was able to do a lot of things that weren't necessarily great for us on the offensive end, but did a lot of things that helped us win basketball games. But I think just settling in, knocking down shots and just getting it going from inside the paint. I feel like you looked at (P.J.) Tucker and (Clint) Capela in the last series (for Houston against Golden State), there were so many shots and so many offensive rebounds that they were able to create extra possessions and get easy touches inside. That's just what I was trying to do and get us a lot of offensive rebounds and beat them on the glass.",NEUTRAL,gpt,1
150346,8,"When I first got traded here I didn't really know what to expect. I thought it I would be here a couple years and be out of here. But the organization is unbelievable, the ownership is unbelievable, management has been great. We have had great people come through here, players, coaches, and just kind of grown for me. I been here now seven years, my kids are in school here. So it's kind of -- it's a situation where I've been home, I call it ""home"" because I'm here nine, ten months out of the year. So just the perception is -- people don't know once you get here, it's actually more than just downtown. So I'm fortunate enough to be able to experience that, the suburban life, the outside-of-downtown life, and it's a pretty great place to be.",POSITIVE,gpt,2
89289,8,"Â , unbelievable.Â The steps that he was taking so far to be the player he is.Â We tell him that no matter the situation, he have to go attack him back, make him work on the defensive end to try to tire his legs on the offensive end. So I think Paul has done a great job of mixing up jumpshots and attacking.Â But we're going to continue to need him to do that, to step up like he did today. FastScripts Transcript by ASAP Sports",POSITIVE,gpt,2
149954,4,"No, , I think you just don't know how people are going to react. I think kind of the main narrative is that Kawhi was super tired and extra minutes and all those kind of things. I think we kind of had that in the back of our minds, but , you just don't know how guys are going to react when the ball goes up, their adrenaline kicks up, etc. I do think Kyle feels like he sees opportunities for himself in these series, and I think Kyle is usually an early, early scorer. He knows leads are precious and he's trying to jump start that. He was humongous last night. We didn't get off to a great start, and I think he automatically changed that by himself.",POSITIVE,gpt,2
149617,6,"Just like we do. Just come in, be focused, make sure we know our game plan, show length, compete every possession, and try to limit them to one shot.",NEUTRAL,gpt,1
119404,10,"I wouldn't say protect himself; I would say more keep your composure. Continue to play hard. Continue to attack the basket. The referees have been doing a great job of calling fouls and making the right calls, so we've just got to be aggressive and continue to attack the basket. If they're going to be physical and try to rough the game up, then we'll benefit by going to the free-throw line.",POSITIVE,gpt,2
176479,1,"Just play basketball. I think he was talking to the whole team. I wasn't the only person that had some turnovers. , it is what it is. I'm going to keep being aggressive. I'm going to keep getting into the paint, making them stop me. I just got to do a better job of finding the right guy. Hopefully next game some of those hand-checking calls, I'll get one. But I'm going to keep being aggressive and keep getting into the paint. Miami does a good job of slapping down and reaching and grabbing, making it tough for you. It's a little bit of both. I got to do a better job, for sure, but overall as a team, we got to do a better job, too.",NEGATIVE,gpt,0
98702,14,Â That's the past.Â We're not worried about that.Â That's the past.,NEUTRAL,gpt,1
166651,3,"Yeah, , I think it's been a theme for us, for him to be aggressive. He knows that that's important to us. He knows that's when we're at our best. , so I think it's just kind of an ongoing, continuing conversations that a lot of the things that happens in the playoffs are hopefully things that you've been talking about or working on during the season and building habits, building the mindset, and he's been good that way.",POSITIVE,gpt,2
159885,10,", that's just who I am. I don't think I was the best player on the floor tonight, though. There's a lot of things that play a factor. We can't forget that Jimmy was still out there. Bam was out there. Goran was out there. There's a lot of good players on the floor tonight. But I think that my confidence is that I can play with anybody, but I don't think that I was the best player on the floor. But I do think that I can play with anybody and I think my confidence is just -- that's just who I am. You can't survive in this league if you don't have confidence.",NEGATIVE,gpt,0
166996,2,"What did you see on the film of Game 5 of the series? NATE McMILLAN: We just did not come out prepared for the intensity of that game, and very similar to, really, Game 2 when they jumped on us. Just for whatever reason, the intensity, we talked about the level of intensity that we needed to come out with. They hit us in the mouth early and really established the physicality of the game. They were going to be in attack mode, and we couldn’t really respond, certainly not in that first quarter. The next three quarters we did a little better job and were able to fight our way back into the game, but they established the tempo of that game right from the start.",NEGATIVE,gpt,0
166996,6,"Did you guys do anything on court today or are you doing to do anything or is it just rest and recovery and film day ahead of tomorrow? NATE McMILLAN: Just get what you need, and that's pretty much all of the above. Some guys need film. Some guys need rest. Some guys need treatment. Some guys need shots. , so that's pretty much the day that we have.",NEUTRAL,gpt,1
166978,6,"Just when guys work hard you like for them to be rewarded. Just like Brook, they want to be there for their team. That kind of selflessness, and when you see it manifest on the court -- but we have to bottle that up and get ready to go on the road and play, find a way to handle that, Bobby, the whole group, we've got to be ready to go.",POSITIVE,gpt,2
99224,0,"Â LeBron, it's very uncharacteristic of you to get into foul trouble early.Â First three fouls early in the ballgame.Â Talk to us about what happened there and what your mindset was going forward. LeBRON JAMES:Â I picked up some early fouls.Â It's definitely something I'm not accustomed to, but my teammates kept it going and put us in a position to win.Â That's all we can ask for.",POSITIVE,gpt,2
99023,1,"Â He just went through the concussion protocol, which is a lot of endurance training to really get your heart rate and your body taxed and then go through the neurological exams after that.Â But a lot of that is a heavier load than guys will typically see in between games.",NEUTRAL,gpt,1
119593,11,"Not to take away from what the team's ultimate goal is, but for as long as you've been here, can you try to conceptualize what it's like to be in Game 6 in the Eastern Conference Finals against the Cavs tomorrow night? DeMAR DeROZAN: I'll be honest with you. It's hard to even believe when you're in these moments because you're in these moments to do what you love to do, and you really don't look at the outside, how they're looking at you. We've been taking this thing every single day, trying to figure out ways to be better, get better and win games. Yu probably really won't realize how big it is until after we've done -- get to sit back and look on it. But like I tell all the guys, we've got to treat this like it's a once-in-a-lifetime opportunity because some guys don't get to be in a Game 6 of a Conference Finals.",POSITIVE,gpt,2
89456,1,"Â Not really.Â Not really.Â We just got to come out and continue to keep playing how we play.Â Don't let nothing distract us, but let nothing take away from what we do.Â Everybody play within themselves and continue to play how they've been playing this postseason. We know our defense, if it's as good as we want it to be, we'll have a shot at winning here.",POSITIVE,gpt,2
159845,8,"Yeah, we knew she was going to be here from the beginning. I've been having a lot of conversations with her early on. Chris Paul has done a hell of a job. He's kind of -- the work he does flies under the radar and the work she's doing kind of flies under the radar in terms of the sacrifices that are being made, the time -- there's a lot of time put in, and she said from the beginning, How can I say I'm all in and really be there to support you guys if I'm not there with you guys? So she's in the trenches with us. And I've also been reading lately, and the leader of the next charge is going to be a woman. Just really fortunate and blessed and happy to see the position she's been in and taking advantage of it and is really supporting us and being behind us 100 percent. And whenever we've called upon her, she's exceeded expectations.",POSITIVE,gpt,2
149907,4,"Everybody's asked me that question. I'm serious. You can't. He's going to have the ball in his hands the whole possession, most of the possessions. He's going to force his way into the lane. He's going to force his way into his spots. He's going to shoot with one, two, sometimes even three or four guys on him. He's going to hit some. He's going to miss some. I keep saying this over and over. He's a great player. You can't stop great players. You can only make it tough on them.",NEUTRAL,gpt,1
99151,2,"Â We've got plenty of counters built in for that, but we've got to execute them. FastScripts Transcript by ASAP Sports",NEUTRAL,gpt,1
166872,11,"It's great. It's a career I've wanted since I was a kid, to be a professional basketball player, to have a huge impact on my team in any way. Each day, my dream is reality, it feels like. I'm out there just playing hard, trying to find a way to win, but also enjoying it and having fun in the moment.",POSITIVE,gpt,2
159928,1,"Bam is one of the great competitors already in this association. He's going to become one of the great winners in the history just because he's so competitive. He moves the needle in every single day. You can't put an analytic to his game and that's probably why he was overlooked in college. He competes every single possession. He's really going into a leadership role. Way beyond his years. His offensive game is just growing daily. And he wants the responsibility, and he wants the accountability, and he isn't afraid of putting that responsibility on his shoulders, and that's what he did the other night. All the greats in the history of the game have done that before. It was not his fault. That was a collective effort, including the coaching staff, but he wanted to take a step forward and put it on his broad shoulders, and he backed that up tonight. He was sensational. And just from a competitive standpoint, all across the board.",POSITIVE,gpt,2
119391,0,I'm not sure. I think he got the wind knocked out of him. So I'm not sure. I don't think it's anything serious.,NEUTRAL,gpt,1
